{
  "id": "photographer.herb-ritts",
  "kind": "photographer",
  "name": "Herb Ritts",
  "version": "1.0.0",
  "description": "classic sculptural form, elegant structure",
  "tags": [
    "photographer",
    "herb-ritts"
  ],
  "prompt_terms": [
    {
      "term": "Herb Ritts",
      "variance": 0.05,
      "weight": 1.0
    },
    {
      "term": "in the style of Herb Ritts",
      "variance": 0.15,
      "weight": 0.8
    }
  ],
  "content": {
    "taxonomy": "hand",
    "taxonomy_note": "proper-name photographic hand",
    "taxonomy_updated": "2026-08-05T23:10:35.965526Z"
  }
}
