{
  "id": "treatment.glossy-classic-nude",
  "kind": "treatment",
  "name": "Glossy Classic Nude",
  "version": "1.0.0",
  "description": "Luminous, clean, sculptural nude treatment with classic glossy finish.",
  "tags": [
    "treatment",
    "glossy",
    "classic",
    "nude"
  ],
  "prompt_terms": [
    {
      "term": "glossy classic nude",
      "variance": 0.25,
      "weight": 1.0
    },
    {
      "term": "luminous sculptural skin",
      "variance": 0.4,
      "weight": 0.8
    },
    {
      "term": "clean classic nude lines",
      "variance": 0.35,
      "weight": 0.7
    }
  ],
  "content": {
    "taxonomy": "treatment",
    "taxonomy_updated": "2026-08-05T23:10:35.965526Z"
  }
}
