{
  "id": "photographer.david-lachapelle",
  "kind": "photographer",
  "name": "David LaChapelle",
  "version": "1.0.0",
  "description": "hyper-surreal explosive energy, saturated blocks",
  "tags": [
    "photographer",
    "david-lachapelle"
  ],
  "prompt_terms": [
    {
      "term": "David LaChapelle",
      "variance": 0.05,
      "weight": 1.0
    },
    {
      "term": "in the style of David LaChapelle",
      "variance": 0.15,
      "weight": 0.8
    }
  ],
  "content": {
    "taxonomy": "hand",
    "taxonomy_note": "proper-name photographic hand",
    "taxonomy_updated": "2026-08-05T23:10:35.965526Z"
  }
}
