{
  "id": "photographer.nobuyoshi-araki",
  "kind": "photographer",
  "name": "Nobuyoshi Araki",
  "version": "1.0.0",
  "description": "raw unhinged intensity, obsessive erotic charge",
  "tags": [
    "photographer",
    "nobuyoshi-araki"
  ],
  "prompt_terms": [
    {
      "term": "Nobuyoshi Araki",
      "variance": 0.05,
      "weight": 1.0
    },
    {
      "term": "in the style of Nobuyoshi Araki",
      "variance": 0.15,
      "weight": 0.8
    }
  ],
  "content": {
    "taxonomy": "hand",
    "taxonomy_note": "proper-name photographic hand",
    "taxonomy_updated": "2026-08-05T23:10:35.965526Z"
  }
}
