{
  "id": "photographer.ellen-von-unwerth",
  "kind": "photographer",
  "name": "Ellen von Unwerth",
  "version": "1.0.0",
  "description": "playful melting sensuality, filmic fluidity",
  "tags": [
    "photographer",
    "ellen-von-unwerth"
  ],
  "prompt_terms": [
    {
      "term": "Ellen von Unwerth",
      "variance": 0.05,
      "weight": 1.0
    },
    {
      "term": "in the style of Ellen von Unwerth",
      "variance": 0.15,
      "weight": 0.8
    }
  ],
  "content": {
    "taxonomy": "hand",
    "taxonomy_note": "proper-name photographic hand",
    "taxonomy_updated": "2026-08-05T23:10:35.965526Z"
  }
}
