{
  "id": "photographer.erwin-olaf",
  "kind": "photographer",
  "name": "Erwin Olaf",
  "version": "1.0.0",
  "description": "dramatic light/shadow, cinematic theatricality",
  "tags": [
    "photographer",
    "erwin-olaf"
  ],
  "prompt_terms": [
    {
      "term": "Erwin Olaf",
      "variance": 0.05,
      "weight": 1.0
    },
    {
      "term": "in the style of Erwin Olaf",
      "variance": 0.15,
      "weight": 0.8
    }
  ],
  "content": {
    "taxonomy": "hand",
    "taxonomy_note": "proper-name photographic hand",
    "taxonomy_updated": "2026-08-05T23:10:35.965526Z"
  }
}
