{
  "id": "hand.willie",
  "kind": "hand",
  "name": "John Willie",
  "version": "1.0.0",
  "description": "Meticulous pen-and-ink fetish illustration. Precise clean line, wasp-waisted elegance, theatrical mild-distress tension, soft idealized contours.",
  "tags": [
    "hand",
    "willie",
    "ink",
    "fetish",
    "elegant"
  ],
  "prompt_terms": [
    {
      "term": "John Willie",
      "variance": 0.05,
      "weight": 1.0
    },
    {
      "term": "in the exact style of John Willie",
      "variance": 0.15,
      "weight": 0.9
    },
    {
      "term": "meticulous pen-and-ink illustration",
      "variance": 0.3,
      "weight": 0.8
    },
    {
      "term": "precise clean line and wasp-waisted elegance",
      "variance": 0.4,
      "weight": 0.7
    }
  ],
  "content": {
    "notes": "Original 8 artist Hand. High-fidelity nervous-system impersonation. Promoted 2026-08-05 under Taxonomy Contract v0.1.0. Keep ultra-low variance on proper name.",
    "taxonomy": "hand",
    "source": "original 8x8 DNA-respecting test set",
    "taxonomy_note": "named artist nervous system",
    "taxonomy_updated": "2026-08-05T23:10:35.965526Z"
  }
}
